{
  "$schema": "http://json-schema.org/draft-07/schema#",
  "$id": "https://example.org/schemas/autoscaler/pool.scaled-out.schema.json",
  "title": "Autoscaler Pool Scaled Out Payload",
  "type": "object",
  "additionalProperties": false,
  "required": [
    "poolId",
    "poolName",
    "previousCapacity",
    "newCapacity",
    "instancesProvisioned",
    "queueDepth",
    "queueDepthThreshold"
  ],
  "properties": {
    "poolId": {
      "type": "string",
      "minLength": 1,
      "description": "Stable identifier of the pool or runner group that was scaled out."
    },
    "poolName": {
      "type": "string",
      "description": "Display name of the pool or runner group."
    },
    "scalingDecisionId": {
      "type": [
        "string",
        "null"
      ],
      "description": "Optional identifier for the scaling decision event, useful for correlating with related events."
    },
    "previousCapacity": {
      "type": "integer",
      "minimum": 0,
      "description": "Previous capacity (total instance count) before scaling out."
    },
    "newCapacity": {
      "type": "integer",
      "minimum": 0,
      "description": "New capacity (total instance count) after scaling out."
    },
    "instancesProvisioned": {
      "type": "integer",
      "minimum": 0,
      "description": "Number of new instances provisioned during this scale-out operation."
    },
    "queueDepth": {
      "type": "integer",
      "minimum": 0,
      "description": "Queue depth at the time the scale-out decision was made."
    },
    "queueDepthThreshold": {
      "type": "integer",
      "minimum": 0,
      "description": "Queue depth threshold that triggered the scale-out operation."
    },
    "details": {
      "type": "object",
      "additionalProperties": true,
      "description": "Provider-specific metadata for this scaling operation, such as autoscaler version, rule identifiers, or scaling algorithm details."
    }
  }
}
